{
 "schema_version": "1.0",
 "contract_version": "1.1.0",
 "generated_at": "2026-10-23",
 "game_build": {
  "client_version": 2000930,
  "patch_version": "1.41.9.0",
  "files_commit": "https://github.com/SteamDatabase/GameTracking-CS2/tree/f68ba6aa24",
  "demo_builds_compatibility": {
   "14190 (1.41.9.0, Thunderpick)": "build de referência",
   "14188 (1.41.8.8, ESL Pro League; commit 7193ca82cb)": "igual, exceto aug.reload_attack_lock_s 3.766667 (hoje 3.2)",
   "14181 (1.41.8.1, StarLadder; commit d8e2c7a4f9)": "igual, exceto aug.reload_attack_lock_s 3.766667 e sem a m14 (arma nova no 1.41.9.0)"
  }
 },
 "sources": {
  "oficial": "weapons.vdata, gamemode_competitive.cfg e items_game.txt da build 2000930 + cvars do servidor do torneio gravadas nas demos",
  "medido": "28 demos de partidas profissionais, 599 rounds"
 },
 "units": {
  "distance": "unidades Source (1 = 0,0254 m)",
  "speed": "unidades/s",
  "time": "segundos",
  "money": "US$ do jogo",
  "angles": "graus"
 },
 "match_config": {
  "ammo_grenade_limit_flashbang": {
   "value": 2,
   "source": "torneio (cvar na demo)"
  },
  "ammo_grenade_limit_total": {
   "value": 4,
   "source": "torneio (cvar na demo)"
  },
  "cash_player_bomb_defused": {
   "value": 300,
   "source": "padrão competitivo"
  },
  "cash_player_bomb_planted": {
   "value": 300,
   "source": "padrão competitivo"
  },
  "cash_player_damage_hostage": {
   "value": -30,
   "source": "padrão competitivo"
  },
  "cash_player_interact_with_hostage": {
   "value": 300,
   "source": "torneio (cvar na demo)"
  },
  "cash_player_killed_enemy_default": {
   "value": 300,
   "source": "padrão competitivo"
  },
  "cash_player_killed_enemy_factor": {
   "value": 1,
   "source": "padrão competitivo"
  },
  "cash_player_killed_hostage": {
   "value": -1000,
   "source": "padrão competitivo"
  },
  "cash_player_killed_teammate": {
   "value": -300,
   "source": "padrão competitivo"
  },
  "cash_player_rescued_hostage": {
   "value": 1000,
   "source": "padrão competitivo"
  },
  "cash_team_bonus_shorthanded": {
   "value": 1000,
   "source": "padrão competitivo"
  },
  "cash_team_elimination_bomb_map": {
   "value": 3250,
   "source": "padrão competitivo"
  },
  "cash_team_elimination_hostage_map_ct": {
   "value": 3000,
   "source": "torneio (cvar na demo)"
  },
  "cash_team_elimination_hostage_map_t": {
   "value": 3000,
   "source": "torneio (cvar na demo)"
  },
  "cash_team_hostage_alive": {
   "value": 0,
   "source": "padrão competitivo"
  },
  "cash_team_hostage_interaction": {
   "value": 600,
   "source": "torneio (cvar na demo)"
  },
  "cash_team_loser_bonus": {
   "value": 1400,
   "source": "padrão competitivo"
  },
  "cash_team_loser_bonus_consecutive_rounds": {
   "value": 500,
   "source": "padrão competitivo"
  },
  "cash_team_planted_bomb_but_defused": {
   "value": 600,
   "source": "padrão competitivo"
  },
  "cash_team_rescued_hostage": {
   "value": 600,
   "source": "torneio (cvar na demo)"
  },
  "cash_team_terrorist_win_bomb": {
   "value": 3500,
   "source": "padrão competitivo"
  },
  "cash_team_win_by_defusing_bomb": {
   "value": 3500,
   "source": "torneio (cvar na demo)"
  },
  "cash_team_win_by_hostage_rescue": {
   "value": 2900,
   "source": "torneio (cvar na demo)"
  },
  "cash_team_win_by_time_running_out_bomb": {
   "value": 3250,
   "source": "padrão competitivo"
  },
  "cash_team_win_by_time_running_out_hostage": {
   "value": 3250,
   "source": "padrão competitivo"
  },
  "ff_damage_reduction_bullets": {
   "value": 0.33,
   "source": "torneio (cvar na demo)"
  },
  "ff_damage_reduction_grenade": {
   "value": 0.85,
   "source": "torneio (cvar na demo)"
  },
  "ff_damage_reduction_grenade_self": {
   "value": 1,
   "source": "padrão competitivo"
  },
  "ff_damage_reduction_other": {
   "value": 0.4,
   "source": "torneio (cvar na demo)"
  },
  "mp_afterroundmoney": {
   "value": 0,
   "source": "padrão competitivo"
  },
  "mp_autokick": {
   "value": false,
   "source": "torneio (cvar na demo)"
  },
  "mp_buy_anywhere": {
   "value": 0,
   "source": "padrão competitivo"
  },
  "mp_buy_during_immunity": {
   "value": 0,
   "source": "padrão competitivo"
  },
  "mp_buytime": {
   "value": 20,
   "source": "torneio (cvar na demo)"
  },
  "mp_ct_default_melee": {
   "value": "weapon_knife",
   "source": "padrão competitivo"
  },
  "mp_ct_default_primary": {
   "value": "",
   "source": "padrão competitivo"
  },
  "mp_ct_default_secondary": {
   "value": "weapon_hkp2000",
   "source": "torneio (cvar na demo)"
  },
  "mp_death_drop_defuser": {
   "value": 1,
   "source": "padrão competitivo"
  },
  "mp_death_drop_grenade": {
   "value": 2,
   "source": "padrão competitivo"
  },
  "mp_death_drop_gun": {
   "value": 1,
   "source": "padrão competitivo"
  },
  "mp_default_team_winner_no_objective": {
   "value": -1,
   "source": "padrão competitivo"
  },
  "mp_defuser_allocation": {
   "value": 0,
   "source": "padrão competitivo"
  },
  "mp_display_kill_assists": {
   "value": 1,
   "source": "padrão competitivo"
  },
  "mp_endmatch_votenextmap": {
   "value": false,
   "source": "torneio (cvar na demo)"
  },
  "mp_force_pick_time": {
   "value": 60,
   "source": "torneio (cvar na demo)",
   "competitive_default": 15
  },
  "mp_forcecamera": {
   "value": 1,
   "source": "torneio (cvar na demo)"
  },
  "mp_free_armor": {
   "value": 0,
   "source": "torneio (cvar na demo)"
  },
  "mp_freezetime": {
   "value": 20,
   "source": "torneio (cvar na demo)",
   "competitive_default": 15
  },
  "mp_friendlyfire": {
   "value": true,
   "source": "torneio (cvar na demo)",
   "competitive_default": 1
  },
  "mp_give_player_c4": {
   "value": true,
   "source": "torneio (cvar na demo)"
  },
  "mp_halftime": {
   "value": true,
   "source": "torneio (cvar na demo)",
   "competitive_default": 1
  },
  "mp_halftime_duration": {
   "value": 90,
   "source": "torneio (cvar na demo)"
  },
  "mp_halftime_pausematch": {
   "value": 1,
   "source": "torneio (cvar na demo)"
  },
  "mp_limitteams": {
   "value": 0,
   "source": "torneio (cvar na demo)"
  },
  "mp_match_can_clinch": {
   "value": 1,
   "source": "padrão competitivo"
  },
  "mp_match_end_restart": {
   "value": true,
   "source": "torneio (cvar na demo)"
  },
  "mp_match_restart_delay": {
   "value": 250,
   "source": "torneio (cvar na demo)"
  },
  "mp_maxmoney": {
   "value": 16000,
   "source": "torneio (cvar na demo)"
  },
  "mp_maxrounds": {
   "value": 24,
   "source": "torneio (cvar na demo)"
  },
  "mp_overtime_enable": {
   "value": true,
   "source": "torneio (cvar na demo)"
  },
  "mp_overtime_startmoney": {
   "value": 12500,
   "source": "torneio (cvar na demo)"
  },
  "mp_playercashawards": {
   "value": 1,
   "source": "padrão competitivo"
  },
  "mp_promoted_item_enabled": {
   "value": false,
   "source": "torneio (cvar na demo)",
   "competitive_default": 0
  },
  "mp_randomspawn": {
   "value": 0,
   "source": "padrão competitivo"
  },
  "mp_randomspawn_los": {
   "value": false,
   "source": "torneio (cvar na demo)",
   "competitive_default": 0
  },
  "mp_respawn_immunitytime": {
   "value": -1,
   "source": "torneio (cvar na demo)"
  },
  "mp_respawn_on_death_ct": {
   "value": 0,
   "source": "padrão competitivo"
  },
  "mp_respawn_on_death_t": {
   "value": 0,
   "source": "padrão competitivo"
  },
  "mp_round_restart_delay": {
   "value": 5,
   "source": "torneio (cvar na demo)"
  },
  "mp_roundtime": {
   "value": 1.92,
   "source": "torneio (cvar na demo)"
  },
  "mp_roundtime_defuse": {
   "value": 1.92,
   "source": "torneio (cvar na demo)"
  },
  "mp_roundtime_hostage": {
   "value": 1.92,
   "source": "torneio (cvar na demo)"
  },
  "mp_solid_teammates": {
   "value": 1,
   "source": "padrão competitivo"
  },
  "mp_spectators_max": {
   "value": 10,
   "source": "torneio (cvar na demo)"
  },
  "mp_starting_losses": {
   "value": 1,
   "source": "torneio (cvar na demo)"
  },
  "mp_startmoney": {
   "value": 800,
   "source": "padrão competitivo"
  },
  "mp_t_default_melee": {
   "value": "weapon_knife",
   "source": "padrão competitivo"
  },
  "mp_t_default_primary": {
   "value": "",
   "source": "padrão competitivo"
  },
  "mp_t_default_secondary": {
   "value": "weapon_glock",
   "source": "torneio (cvar na demo)"
  },
  "mp_team_intro_time": {
   "value": 0,
   "source": "torneio (cvar na demo)"
  },
  "mp_team_timeout_max": {
   "value": 3,
   "source": "torneio (cvar na demo)"
  },
  "mp_team_timeout_ot_add_each": {
   "value": 1,
   "source": "torneio (cvar na demo)"
  },
  "mp_team_timeout_ot_add_once": {
   "value": 1,
   "source": "torneio (cvar na demo)"
  },
  "mp_team_timeout_time": {
   "value": 30,
   "source": "torneio (cvar na demo)"
  },
  "mp_teamcashawards": {
   "value": 1,
   "source": "padrão competitivo"
  },
  "mp_technical_timeout_duration_s": {
   "value": 120,
   "source": "torneio (cvar na demo)"
  },
  "mp_technical_timeout_per_team": {
   "value": 1,
   "source": "torneio (cvar na demo)"
  },
  "mp_timelimit": {
   "value": 0,
   "source": "padrão competitivo"
  },
  "mp_warmup_pausetimer": {
   "value": 1,
   "source": "torneio (cvar na demo)"
  },
  "mp_warmuptime": {
   "value": 60,
   "source": "torneio (cvar na demo)",
   "competitive_default": 120
  },
  "mp_warmuptime_all_players_connected": {
   "value": 15,
   "source": "padrão competitivo"
  },
  "mp_weapons_allow_map_placed": {
   "value": true,
   "source": "torneio (cvar na demo)",
   "competitive_default": 1
  },
  "mp_weapons_allow_typecount": {
   "value": -1,
   "source": "torneio (cvar na demo)"
  },
  "mp_weapons_allow_zeus": {
   "value": 5,
   "source": "torneio (cvar na demo)"
  },
  "mp_weapons_glow_on_ground": {
   "value": 0,
   "source": "padrão competitivo"
  },
  "mp_win_panel_display_time": {
   "value": 999,
   "source": "torneio (cvar na demo)",
   "competitive_default": 3
  },
  "spec_freeze_time": {
   "value": 2,
   "source": "torneio (cvar na demo)",